{
  "authority": {
    "class": "user",
    "proofs": {
      "wsqk": {
        "action": "send",
        "context_hash": "3d92615f920ff2b0529e0967ce92a957e8616c785969961c5c21746e0488cce5",
        "expires_at": 1706990460,
        "issued_at": 1706990400,
        "nonce": "n1",
        "wallet_id": "w1"
      }
    },
    "scope": {
      "policy_pack": "default"
    }
  },
  "context": {
    "action": "send",
    "app_id": "app",
    "device_id": "d1",
    "fields": {
      "amount": "1",
      "asset": "DGB",
      "ui_confirmed": "true"
    },
    "session_id": "s1",
    "wallet_id": "w1"
  },
  "intent": "authorize",
  "nonce": {
    "mode": "single_use",
    "store": "tva",
    "value": "n1"
  },
  "payload": {
    "body": {
      "runtime_override": {
        "context_hash": "evil",
        "protection_mode": "off",
        "reason_id": "OK_ALLOW",
        "status": "allow"
      },
      "ui_confirmed": true
    },
    "evidence": {
      "oracle": {
        "ac_iface_version": "adaptive_core_oracle_v3",
        "context_hash": "3d92615f920ff2b0529e0967ce92a957e8616c785969961c5c21746e0488cce5",
        "expires_at": 1706990405,
        "external_source_id": "ac-prod-1",
        "generated_at": 1706990399,
        "issued_at": 1706990395,
        "oracle_version": "adaptive-core/3.0.0",
        "overall_score": 99,
        "signals": [
          {
            "reason_ids": [
              "AC_OK"
            ],
            "severity": 10,
            "source": "ac_model"
          }
        ]
      },
      "qid": {
        "context_hash": "3d92615f920ff2b0529e0967ce92a957e8616c785969961c5c21746e0488cce5",
        "device_binding": "device-1",
        "expires_at": 1706990410,
        "issued_at": 1706990390,
        "issuer_version": "qid-v0",
        "proof_hash": "3e6293faf449546749f3b7fea31beca92db0b9b39c6f6d04a5f236a6f4b2cc14",
        "qid_iface_version": "qid-session-v0",
        "replay_proof": {
          "device_binding": "device-1",
          "fresh": true,
          "proof_hash": "3e6293faf449546749f3b7fea31beca92db0b9b39c6f6d04a5f236a6f4b2cc14",
          "proof_version": "qid-replay-v1",
          "registry_commitment": "reg-commit-1",
          "session_nonce": "n1",
          "subject": "did:example:123",
          "wallet_id": "w1"
        },
        "subject": "did:example:123"
      },
      "shield": {
        "bundle_id": "b1",
        "context_hash": "3d92615f920ff2b0529e0967ce92a957e8616c785969961c5c21746e0488cce5",
        "expires_at": 1706990460,
        "issued_at": 1706990400,
        "meta": {},
        "required_layers": [
          "sentinel_ai",
          "adn",
          "dqsn",
          "qwg",
          "guardian_wallet"
        ],
        "shield_bundle_version": "1.0.0",
        "signals": [
          {
            "confidence": 90,
            "context_hash": "3d92615f920ff2b0529e0967ce92a957e8616c785969961c5c21746e0488cce5",
            "expires_at": 1706990460,
            "facts": {
              "k": "v"
            },
            "issued_at": 1706990400,
            "layer": "adn",
            "layer_version": "1.0.0",
            "meta": {},
            "reason_id": "OK",
            "signal_id": "adn-2",
            "v": "shield_signal_v3",
            "verdict": "allow"
          },
          {
            "confidence": 90,
            "context_hash": "3d92615f920ff2b0529e0967ce92a957e8616c785969961c5c21746e0488cce5",
            "expires_at": 1706990460,
            "facts": {
              "k": "v"
            },
            "issued_at": 1706990400,
            "layer": "dqsn",
            "layer_version": "1.0.0",
            "meta": {},
            "reason_id": "OK",
            "signal_id": "dqsn-3",
            "v": "shield_signal_v3",
            "verdict": "allow"
          },
          {
            "confidence": 90,
            "context_hash": "3d92615f920ff2b0529e0967ce92a957e8616c785969961c5c21746e0488cce5",
            "expires_at": 1706990460,
            "facts": {
              "k": "v"
            },
            "issued_at": 1706990400,
            "layer": "guardian_wallet",
            "layer_version": "1.0.0",
            "meta": {},
            "reason_id": "OK",
            "signal_id": "guardian_wallet-5",
            "v": "shield_signal_v3",
            "verdict": "allow"
          },
          {
            "confidence": 90,
            "context_hash": "3d92615f920ff2b0529e0967ce92a957e8616c785969961c5c21746e0488cce5",
            "expires_at": 1706990460,
            "facts": {
              "k": "v"
            },
            "issued_at": 1706990400,
            "layer": "qwg",
            "layer_version": "1.0.0",
            "meta": {},
            "reason_id": "OK",
            "signal_id": "qwg-4",
            "v": "shield_signal_v3",
            "verdict": "allow"
          },
          {
            "confidence": 90,
            "context_hash": "3d92615f920ff2b0529e0967ce92a957e8616c785969961c5c21746e0488cce5",
            "expires_at": 1706990460,
            "facts": {
              "k": "v"
            },
            "issued_at": 1706990400,
            "layer": "sentinel_ai",
            "layer_version": "1.0.0",
            "meta": {},
            "reason_id": "OK",
            "signal_id": "sentinel_ai-1",
            "v": "shield_signal_v3",
            "verdict": "allow"
          }
        ],
        "v": "shield_bundle_v3"
      }
    }
  },
  "request_id": "req-1",
  "timebox": {
    "expires_at": "2024-02-03T20:01:00Z",
    "issued_at": "2024-02-03T20:00:00Z"
  },
  "v": "execution_request_v2"
}
