{
  "authority": {
    "class": "user",
    "proofs": {
      "wsqk": {
        "action": "send",
        "context_hash": "f329ebc5291948197986496ffea7b1bc13bf0a7f35682849fab31e1f9eb4fb3b",
        "expires_at": 1706990460,
        "issued_at": 1706990400,
        "nonce": "n1",
        "wallet_id": "w1"
      }
    },
    "scope": {
      "policy_pack": "default"
    }
  },
  "context": {
    "action": "send",
    "app_id": "app",
    "device_id": "d1",
    "fields": {
      "amount": "1",
      "asset": "DGB"
    },
    "session_id": "s1",
    "wallet_id": "w1"
  },
  "intent": "authorize",
  "nonce": {
    "mode": "single_use",
    "store": "tva",
    "value": "n1"
  },
  "payload": {
    "body": {
      "runtime_override": {
        "status": "allow"
      },
      "ui_confirmed": true
    },
    "evidence": {
      "oracle": {
        "ac_iface_version": "adaptive_core_oracle_v3",
        "context_hash": "f329ebc5291948197986496ffea7b1bc13bf0a7f35682849fab31e1f9eb4fb3b",
        "expires_at": 1706990405,
        "external_source_id": "ac-prod-1",
        "generated_at": 1706990399,
        "issued_at": 1706990395,
        "oracle_version": "adaptive-core/3.0.0",
        "overall_score": 99,
        "signals": [
          {
            "reason_ids": [
              "AC_OK"
            ],
            "severity": 10,
            "source": "ac_model"
          }
        ]
      },
      "qid": {
        "context_hash": "f329ebc5291948197986496ffea7b1bc13bf0a7f35682849fab31e1f9eb4fb3b",
        "device_binding": "device-1",
        "expires_at": 1706990410,
        "issued_at": 1706990390,
        "issuer_version": "qid-v0",
        "proof_hash": "a8822fa38a4695c7c09154f6237ce7c3523fee0acefaf35f5799c1517a1090e3",
        "qid_iface_version": "qid-session-v0",
        "subject": "did:example:123"
      },
      "shield": {
        "bundle_id": "b1",
        "context_hash": "f329ebc5291948197986496ffea7b1bc13bf0a7f35682849fab31e1f9eb4fb3b",
        "expires_at": 1706990460,
        "issued_at": 1706990400,
        "meta": {},
        "required_layers": [
          "sentinel_ai",
          "adn",
          "dqsn",
          "qwg",
          "guardian_wallet"
        ],
        "shield_bundle_version": "v3",
        "signals": [
          {
            "confidence": 90,
            "context_hash": "f329ebc5291948197986496ffea7b1bc13bf0a7f35682849fab31e1f9eb4fb3b",
            "expires_at": 1706990460,
            "facts": {
              "k": "v"
            },
            "issued_at": 1706990400,
            "layer": "sentinel_ai",
            "layer_version": "v3",
            "meta": {},
            "reason_id": "ok",
            "signal_id": "sentinel_ai-1",
            "v": "shield_signal_v3",
            "verdict": "allow"
          }
        ],
        "v": "shield_bundle_v3"
      }
    }
  },
  "request_id": "req-1",
  "timebox": {
    "expires_at": "2024-02-03T20:01:00Z",
    "issued_at": "2024-02-03T20:00:00Z"
  },
  "v": "execution_request_v2"
}
