{
  "v": "execution_request_v2",
  "request_id": "req-deny-1",
  "intent": "authorize",
  "context": {
    "wallet_id": "w1",
    "device_id": "d1",
    "app_id": "app",
    "session_id": "s1",
    "action": "send",
    "fields": {
      "asset": "DGB",
      "amount": "1"
    }
  },
  "authority": {
    "class": "user",
    "scope": {
      "policy_pack": "default"
    },
    "proofs": {}
  },
  "timebox": {
    "issued_at": "2024-02-03T20:00:00Z",
    "expires_at": "2024-02-03T20:01:00Z"
  },
  "nonce": {
    "value": "n1",
    "store": "tva",
    "mode": "single_use"
  },
  "payload": {
    "evidence": {
      "qid": {
        "qid_iface_version": "qid-session-v0",
        "subject": "did:example:123",
        "issued_at": 1706990390,
        "expires_at": 1706990410,
        "proof_hash": "proofhash123",
        "device_binding": "device-1",
        "issuer_version": "qid-v0"
      },
      "oracle": {
        "ac_iface_version": "adaptive_core_oracle_v3",
        "context_hash": "f329ebc5291948197986496ffea7b1bc13bf0a7f35682849fab31e1f9eb4fb3b",
        "issued_at": 1706990395,
        "expires_at": 1706990405,
        "generated_at": 1706990399,
        "overall_score": 10,
        "signals": [
          {
            "source": "ac_model",
            "severity": 10,
            "reason_ids": [
              "AC_OK"
            ]
          }
        ],
        "oracle_version": "adaptive-core/3.0.0",
        "external_source_id": "ac-prod-1"
      },
      "shield": {
        "v": "shield_bundle_v3",
        "bundle_id": "b1",
        "context_hash": "f329ebc5291948197986496ffea7b1bc13bf0a7f35682849fab31e1f9eb4fb3b",
        "issued_at": 1706990400,
        "expires_at": 1706990460,
        "required_layers": [
          "sentinel_ai",
          "adn",
          "dqsn",
          "qwg",
          "guardian_wallet"
        ],
        "signals": [
          {
            "v": "shield_signal_v3",
            "layer": "adn",
            "signal_id": "a-1",
            "context_hash": "f329ebc5291948197986496ffea7b1bc13bf0a7f35682849fab31e1f9eb4fb3b",
            "issued_at": 1706990400,
            "expires_at": 1706990460,
            "verdict": "allow",
            "reason_id": "OK",
            "confidence": 90,
            "facts": {
              "k": "v"
            },
            "meta": {}
          },
          {
            "v": "shield_signal_v3",
            "layer": "dqsn",
            "signal_id": "d-1",
            "context_hash": "f329ebc5291948197986496ffea7b1bc13bf0a7f35682849fab31e1f9eb4fb3b",
            "issued_at": 1706990400,
            "expires_at": 1706990460,
            "verdict": "allow",
            "reason_id": "OK",
            "confidence": 90,
            "facts": {
              "k": "v"
            },
            "meta": {}
          },
          {
            "v": "shield_signal_v3",
            "layer": "guardian_wallet",
            "signal_id": "g-1",
            "context_hash": "f329ebc5291948197986496ffea7b1bc13bf0a7f35682849fab31e1f9eb4fb3b",
            "issued_at": 1706990400,
            "expires_at": 1706990460,
            "verdict": "allow",
            "reason_id": "OK",
            "confidence": 90,
            "facts": {
              "k": "v"
            },
            "meta": {}
          },
          {
            "v": "shield_signal_v3",
            "layer": "qwg",
            "signal_id": "q-1",
            "context_hash": "f329ebc5291948197986496ffea7b1bc13bf0a7f35682849fab31e1f9eb4fb3b",
            "issued_at": 1706990400,
            "expires_at": 1706990460,
            "verdict": "allow",
            "reason_id": "OK",
            "confidence": 90,
            "facts": {
              "k": "v"
            },
            "meta": {}
          },
          {
            "v": "shield_signal_v3",
            "layer": "sentinel_ai",
            "signal_id": "s-1",
            "context_hash": "f329ebc5291948197986496ffea7b1bc13bf0a7f35682849fab31e1f9eb4fb3b",
            "issued_at": 1706990400,
            "expires_at": 1706990460,
            "verdict": "allow",
            "reason_id": "OK",
            "confidence": 90,
            "facts": {
              "k": "v"
            },
            "meta": {}
          }
        ],
        "meta": {}
      }
    },
    "body": {
      "ui_confirmed": true
    }
  }
}
